query_id,query,num_relevant,relevant_ids
q_019506,"When should domain-specific dispersion be used to predict progression to mild cognitive impairment and dementia in patients, particularly in scenarios where controlling for demographics, ApoE4 status, and MMSE is necessary?",14,Clin Neuropsychol. 2025 Nov 12:1-25. doi: 10.1080/13854046.2025.2577149.; Clin Neuropsychol. 2025 Nov 12:1-25. doi: 10.1080/13854046.2025.2577149.; Clin Neuropsychol. 2025 Nov 12:1-25. doi: 10.1080/13854046.2025.2577149.; Clin Neuropsychol. 2025 Nov 12:1-25. doi: 10.1080/13854046.2025.2577149.; Comput Methods Programs Biomed. 2025 Nov 11;274:109162. doi:
q_537961,What is the difference in median time to sputum culture conversion between smear-positive and smear-negative samples?,5,BMC Pulm Med. 2025 Nov 11;25(1):518. doi: 10.1186/s12890-025-03986-2.; BMC Pulm Med. 2025 Nov 11;25(1):518. doi: 10.1186/s12890-025-03986-2.; BMC Pulm Med. 2025 Nov 11;25(1):518. doi: 10.1186/s12890-025-03986-2.; BMC Pulm Med. 2025 Nov 11;25(1):518. doi: 10.1186/s12890-025-03986-2.; Open Forum Infect Dis. 2025 Nov 12;12(11):ofaf664. doi: 10.1093/ofid/ofaf664.
q_673630,What are the differences in how professional bodies and national societies define and support radiographer practice in interventional radiology and interventional cardiology across European countries?,4,Radiography (Lond). 2025 Nov 13:103236. doi: 10.1016/j.radi.2025.103236.; Radiography (Lond). 2025 Nov 13:103236. doi: 10.1016/j.radi.2025.103236.; Radiography (Lond). 2025 Nov 13:103236. doi: 10.1016/j.radi.2025.103236.; Radiography (Lond). 2025 Nov 13:103236. doi: 10.1016/j.radi.2025.103236.
q_389443,"How does the fibrinolytic system modulate outcome after liver, kidney, and lung transplantation through its role in fibrin formation and dissolution?",6,Arterioscler Thromb Vasc Biol. 2025 Nov 13. doi: 10.1161/ATVBAHA.125.321621.; Arterioscler Thromb Vasc Biol. 2025 Nov 13. doi: 10.1161/ATVBAHA.125.321621.; Arterioscler Thromb Vasc Biol. 2025 Nov 13. doi: 10.1161/ATVBAHA.125.321621.; TH Open. 2025 Oct 29;9:a27199152. doi: 10.1055/a-2719-9152. eCollection 2025.; TH Open. 2025 Oct 29;9:a27199152. doi: 10.1055/a-2719-9152. eCollection 2025.
q_956141,"What are the most commonly reported adverse events associated with cefotaxime, ceftazidime, and cefdinir, respectively, according to the FDA adverse event reporting system database?",4,Medicine (Baltimore). 2025 Nov 7;104(45):e45778. doi:; Medicine (Baltimore). 2025 Nov 7;104(45):e45778. doi:; Medicine (Baltimore). 2025 Nov 7;104(45):e45778. doi:; 2024-385. TASO REC is accredited by the Uganda
q_005893,What is the mechanism by which radiomic features extracted from contrast-enhancing tumor regions on pre-radiotherapy MRI across multiple imaging sequences provide prognostic value in glioblastoma patients?,9,Eur J Med Res. 2025 Nov 14;30(1):1121. doi: 10.1186/s40001-025-03333-5.; Eur J Med Res. 2025 Nov 14;30(1):1121. doi: 10.1186/s40001-025-03333-5.; Eur J Med Res. 2025 Nov 14;30(1):1121. doi: 10.1186/s40001-025-03333-5.; Front Cell Dev Biol. 2025 Oct 29;13:1673498. doi: 10.3389/fcell.2025.1673498.; Eur Radiol Exp. 2025 Nov 14;9(1):111. doi: 10.1186/s41747-025-00652-4.
q_326194,"In urban HIV care settings, what strategies can be employed to enhance vaccination rates, considering the complexities of measuring intervention impacts in real-world settings?",11,AIDS Behav. 2025 Nov 12. doi: 10.1007/s10461-025-04948-9.; AIDS Behav. 2025 Nov 12. doi: 10.1007/s10461-025-04948-9.; AIDS Behav. 2025 Nov 12. doi: 10.1007/s10461-025-04948-9.; BMC Public Health. 2025 Nov 10;25(1):3885. doi: 10.1186/s12889-025-25017-9.; Pan Afr Med J. 2025 Jun 11;51(Suppl 1):2. doi:
q_634210,"What is the feasibility of conducting a fully virtual Community Health Assessment Tool (CHAT) remotely, according to the study published in Health Expectation in 2025?",1,Health Expect. 2025 Dec;28(6):e70487. doi: 10.1111/hex.70487.
q_085722,"In what scenarios should virtual fixtures (VFs) be utilized to optimize surgical performance and training, particularly in complex surgical procedures such as neurosurgery and fetal laser surgery?",4,Comput Biol Med. 2025 Nov 12;199:111294. doi: 10.1016/j.compbiomed.2025.111294.; Comput Biol Med. 2025 Nov 12;199:111294. doi: 10.1016/j.compbiomed.2025.111294.; Comput Biol Med. 2025 Nov 12;199:111294. doi: 10.1016/j.compbiomed.2025.111294.; World J Surg Oncol. 2025 Nov 13;23(1):433. doi: 10.1186/s12957-025-04087-4.
q_634093,What are the key factors to consider when differentiating between focal atrial tachycardia and atrial flutter in neonates to guide proper diagnosis and therapy?,4,Clin Perinatol. 2025 Dec;52(4):731-746. doi: 10.1016/j.clp.2025.08.006. Epub 2025; J Cardiovasc Dev Dis. 2025 Oct 1;12(10):386. doi: 10.3390/jcdd12100386.; BMC Cardiovasc Disord. 2025 Nov 7;25(1):791. doi: 10.1186/s12872-025-05275-6.; Card Electrophysiol Clin. 2025 Dec;17(4):509-529. doi:
q_333750,"What is the mechanism by which prenatal diagnosis of isolated right aortic arch (iRAA) influences postnatal vascular ring management, particularly in relation to symptom development and surgical referral?",3,Pediatr Pulmonol. 2025 Nov;60(11):e71381. doi: 10.1002/ppul.71381.; Pediatr Pulmonol. 2025 Nov;60(11):e71381. doi: 10.1002/ppul.71381.; Pediatr Pulmonol. 2025 Nov;60(11):e71381. doi: 10.1002/ppul.71381.
q_116514,What is the proposed mechanism by which trochanteric fractures occur in patients undergoing robotic-assisted total hip arthroplasty with proximal femoral array screw placement?,4,Ann Jt. 2025 Oct 22;10:43. doi: 10.21037/aoj-25-5. eCollection 2025.; Ann Jt. 2025 Oct 22;10:43. doi: 10.21037/aoj-25-5. eCollection 2025.; Ann Jt. 2025 Oct 22;10:43. doi: 10.21037/aoj-25-5. eCollection 2025.; Zhongguo Gu Shang. 2025 Oct 25;38(10):1001-8. doi:
q_987191,What is the proposed mechanism by which the aryl hydrocarbon receptor (AHR) protects against the damaging effects of cigarette smoke in chronic obstructive pulmonary disease (COPD) by attenuating pulmonary neutrophilia?,8,J Immunol. 2025 Nov 9:vkaf280. doi: 10.1093/jimmun/vkaf280.; J Immunol. 2025 Nov 9:vkaf280. doi: 10.1093/jimmun/vkaf280.; J Immunol. 2025 Nov 9:vkaf280. doi: 10.1093/jimmun/vkaf280.; J Immunol. 2025 Nov 9:vkaf280. doi: 10.1093/jimmun/vkaf280.; Int J Chron Obstruct Pulmon Dis. 2025 Oct 30;20:3545-3557. doi:
q_256940,What are the key architectural differences between traditional centralized digital health ecosystems and decentralized digital health ecosystems that enable AI-enhanced applications?,5,Front Digit Health. 2025 Oct 27;7:1685628. doi: 10.3389/fdgth.2025.1685628.; Front Digit Health. 2025 Oct 27;7:1685628. doi: 10.3389/fdgth.2025.1685628.; Digit Health. 2025 Nov 11;11:20552076251395551. doi: 10.1177/20552076251395551.; Healthcare (Basel). 2025 Oct 10;13(20):2553. doi: 10.3390/healthcare13202553.; Healthcare (Basel). 2025 Oct 30;13(21):2753. doi: 10.3390/healthcare13212753.
q_779784,What was the effect of metformin on free testosterone levels in male type 2 diabetes mellitus (T2DM) patients after 30 days of treatment?,4,Medicine (Baltimore). 2025 Nov 7;104(45):e44989. doi:; Medicine (Baltimore). 2025 Nov 7;104(45):e44989. doi:; Medicine (Baltimore). 2025 Nov 7;104(45):e44989. doi:; Transl Androl Urol. 2025 Oct 31;14(10):3387-3401. doi: 10.21037/tau-2025-440.
q_797971,"In a post-cardiac surgery patient with a history of ventricular septal defect repair, what are the key echocardiography findings that suggest a diagnosis of focal constrictive pericarditis presenting with biventricular failure?",1,J Saudi Heart Assoc. 2025 Oct 31;37(4):1463. doi: 10.37616/2212-5043.1463.
q_881417,"In patients experiencing out-of-hospital cardiac arrest (OHCA), what sex-specific differences in initial rhythm are observed, and how do substance use disorders and atrial fibrillation impact these differences?",7,Resuscitation. 2025 Nov 11:110894. doi: 10.1016/j.resuscitation.2025.110894.; Resuscitation. 2025 Nov 11:110894. doi: 10.1016/j.resuscitation.2025.110894.; Resuscitation. 2025 Nov 11:110894. doi: 10.1016/j.resuscitation.2025.110894.; Heart. 2025 Nov 6:heartjnl-2025-326987. doi: 10.1136/heartjnl-2025-326987.; Heart. 2025 Nov 6:heartjnl-2025-326987. doi: 10.1136/heartjnl-2025-326987.
q_943227,"What is the recommended approach for managing inflammatory bowel disease in patients from preconception to pregnancy, and how should treatment be adjusted during this period?",10,Expert Rev Gastroenterol Hepatol. 2025 Oct 22:1-12. doi:; Expert Rev Gastroenterol Hepatol. 2025 Oct 22:1-12. doi:; Expert Rev Gastroenterol Hepatol. 2025 Oct 22:1-12. doi:; Rev Med Suisse. 2025 Aug 27;21(928):1506-1510. doi:; United European Gastroenterol J. 2025 Oct 14. doi: 10.1002/ueg2.70122.
q_071875,What is the association between fever and infections in early life and the subsequent risk of developing atopic diseases?,12,Pediatr Allergy Immunol. 2025 Oct;36(10):e70209. doi: 10.1111/pai.70209.; Pediatr Allergy Immunol. 2025 Oct;36(10):e70209. doi: 10.1111/pai.70209.; Pediatr Allergy Immunol. 2025 Oct;36(10):e70209. doi: 10.1111/pai.70209.; Br J Dermatol. 2025 Oct 31:ljaf416. doi: 10.1093/bjd/ljaf416.; Pediatr Allergy Immunol. 2025 Sep;36(9):e70203. doi: 10.1111/pai.70203.
q_660914,"What are the main mechanisms by which priorities are identified in healthcare settings, according to the analysis of priority setting approaches?",5,BMJ Public Health. 2024 Dec 12;2(2):e001097. doi: 10.1136/bmjph-2024-001097.; BMJ Public Health. 2024 Dec 12;2(2):e001097. doi: 10.1136/bmjph-2024-001097.; Learn Health Syst. 2025 May 14;9(4):e70016. doi: 10.1002/lrh2.70016. eCollection; BMC Med Ethics. 2025 Oct 27;26(1):148. doi: 10.1186/s12910-025-01305-2.; BMC Med Ethics. 2025 Oct 27;26(1):148. doi: 10.1186/s12910-025-01305-2.
q_490011,"In patients undergoing minimally invasive nasal surgery, what are the implications of concurrent obstructive sleep apnea (OSA) and hypertension on perioperative management to mitigate the risk of major epistaxis?",8,J Otolaryngol Head Neck Surg. 2025 Jan-Dec;54:19160216251390319. doi:; J Otolaryngol Head Neck Surg. 2025 Jan-Dec;54:19160216251390319. doi:; Sleep Med Rev. 2025 Oct 30;84:102194. doi: 10.1016/j.smrv.2025.102194.; J Otolaryngol Head Neck Surg. 2025 Jan-Dec;54:19160216251390319. doi:; J Otolaryngol Head Neck Surg. 2025 Jan-Dec;54:19160216251390319. doi:
q_396326,"What is the difference in research outcomes when researchers explicitly acknowledge positionality and adopt reflexive practices versus when they do not, in terms of managing assumptions and biases?",4,J Hum Lact. 2025 Sep 26:8903344251369433. doi: 10.1177/08903344251369433.; J Hum Lact. 2025 Sep 26:8903344251369433. doi: 10.1177/08903344251369433.; J Hum Lact. 2025 Sep 26:8903344251369433. doi: 10.1177/08903344251369433.; J Adv Nurs. 2025 Nov 14. doi: 10.1111/jan.70392.
q_012800,"What is the proposed mechanism by which internalized HIV stigma (IHS) affects antiretroviral therapy (ART) adherence in people with HIV (PWH), according to the study?",4,J Acquir Immune Defic Syndr. 2025 Nov 6. doi: 10.1097/QAI.0000000000003793.; J Acquir Immune Defic Syndr. 2025 Nov 6. doi: 10.1097/QAI.0000000000003793.; J Acquir Immune Defic Syndr. 2025 Nov 6. doi: 10.1097/QAI.0000000000003793.; AIDS Care. 2025 Nov 10:1-21. doi: 10.1080/09540121.2025.2584602.
q_575573,"What is the potential role of MLS in cisplatin-based lung cancer treatment, and how does it compare to DES in terms of modulating therapeutic efficacy?",3,Turk J Biol. 2025 Sep 13;49(6):690-699. doi: 10.55730/1300-0152.2771. eCollection; Turk J Biol. 2025 Sep 13;49(6):690-699. doi: 10.55730/1300-0152.2771. eCollection; Turk J Biol. 2025 Sep 13;49(6):690-699. doi: 10.55730/1300-0152.2771. eCollection
q_840739,What is the difference in effectiveness between telehealth-delivered Child and Family Traumatic Stress Intervention (CFTSI) and non-specific psychological support in reducing post-traumatic symptoms in children aged 7-17 after recent traumatic events?,5,BMC Psychol. 2025 Nov 12;13(1):1254. doi: 10.1186/s40359-025-03585-0.; BMC Psychol. 2025 Nov 12;13(1):1254. doi: 10.1186/s40359-025-03585-0.; BMC Psychol. 2025 Nov 12;13(1):1254. doi: 10.1186/s40359-025-03585-0.; BMC Psychol. 2025 Nov 12;13(1):1254. doi: 10.1186/s40359-025-03585-0.; Support Care Cancer. 2025 Nov 14;33(12):1062. doi: 10.1007/s00520-025-10113-8.
q_199813,"What was the effect of Cytosorb therapy on bilirubin levels in patients with acute liver failure, according to the retrospective single centre study?",4,Liver Int. 2025 Dec;45(12):e70420. doi: 10.1111/liv.70420.; Liver Int. 2025 Dec;45(12):e70420. doi: 10.1111/liv.70420.; Liver Int. 2025 Dec;45(12):e70420. doi: 10.1111/liv.70420.; J Intensive Med. 2025 Jun 27;5(4):392-399. doi: 10.1016/j.jointm.2025.05.001.
q_927472,What are common comorbidities that patients with a history of congenital heart defect interventions often face in the long term?,10,Clin Perinatol. 2025 Dec;52(4):761-770. doi: 10.1016/j.clp.2025.08.007. Epub 2025; Int J Cardiol. 2025 Nov 5;444:134004. doi: 10.1016/j.ijcard.2025.134004.; Int J Psychiatry Med. 2025 Nov 10:912174251395848. doi:; Europace. 2025 Nov 10:euaf292. doi: 10.1093/europace/euaf292.; Curr Opin Pediatr. 2025 Dec 1;37(6):591-596. doi: 10.1097/MOP.0000000000001517.
q_928684,"What are the major risk factors for hypertension in children and adolescents, according to recent studies?",8,Hypertens Res. 2025 Nov 14. doi: 10.1038/s41440-025-02459-7.; Hypertens Res. 2025 Nov 14. doi: 10.1038/s41440-025-02459-7.; Front Nutr. 2025 Oct 29;12:1562992. doi: 10.3389/fnut.2025.1562992. eCollection; Hypertens Res. 2025 Nov 14. doi: 10.1038/s41440-025-02459-7.; Front Nutr. 2025 Oct 29;12:1562992. doi: 10.3389/fnut.2025.1562992. eCollection
q_027528,"In a setting with socio-economic disparities, how does the effectiveness of long-lasting insecticide-treated nets (LLINs) in malaria control vary when nets are available for no more than two people, and what is the impact of adjusting for socio-economic status (SES) on this effectiveness?",6,Malar J. 2025 Oct 22;24(1):355. doi: 10.1186/s12936-025-05528-x.; Malar J. 2025 Oct 22;24(1):355. doi: 10.1186/s12936-025-05528-x.; Malar J. 2025 Oct 22;24(1):355. doi: 10.1186/s12936-025-05528-x.; Malar J. 2025 Oct 22;24(1):355. doi: 10.1186/s12936-025-05528-x.; Malar J. 2025 Nov 5;24(1):374. doi: 10.1186/s12936-025-05621-1.
q_512219,"In what scenarios can patient-specific algorithmic refinements of continuous glucose monitoring (CGM) data be applied to improve inpatient diabetes care, particularly in reducing intrapersonal mean absolute relative difference (MARD)?",6,Diabetes Care. 2025 Nov 3:dc251494. doi: 10.2337/dc25-1494.; Diabetes Care. 2025 Nov 3:dc251494. doi: 10.2337/dc25-1494.; Diabetes Care. 2025 Nov 3:dc251494. doi: 10.2337/dc25-1494.; Sci Rep. 2025 Nov 13;15(1):39891. doi: 10.1038/s41598-025-23762-w.; J Diabetes Sci Technol. 2025 Nov 10:19322968251388107. doi:
q_662545,"What is the recommended approach for managing chronic total occlusion (CTO) revascularization, and what are the current indications for percutaneous coronary intervention (PCI) in CTO patients?",6,Int J Angiol. 2025 Aug 4;34(4):354-359. doi: 10.1055/a-2655-2536. eCollection; Cureus. 2025 Oct 11;17(10):e94356. doi: 10.7759/cureus.94356. eCollection 2025; Front Cardiovasc Med. 2025 Oct 29;12:1637403. doi: 10.3389/fcvm.2025.1637403.; J Clin Med. 2025 Oct 27;14(21):7626. doi: 10.3390/jcm14217626.; Cureus. 2025 Oct 11;17(10):e94356. doi: 10.7759/cureus.94356. eCollection 2025
q_735267,What are the differences in patients' experiences of ward rounds in a Swedish context compared to other healthcare settings in terms of patient involvement and communication?,5,BMJ Open. 2025 Nov 13;15(11):e103481. doi: 10.1136/bmjopen-2025-103481.; BMJ Open. 2025 Nov 13;15(11):e103481. doi: 10.1136/bmjopen-2025-103481.; BMJ Open. 2025 Nov 13;15(11):e103481. doi: 10.1136/bmjopen-2025-103481.; BMC Pulm Med. 2025 Nov 13;25(1):524. doi: 10.1186/s12890-025-04024-x.; BMC Psychiatry. 2025 Nov 12;25(1):1084. doi: 10.1186/s12888-025-07523-7.
q_271776,"In patients with suspected hand osteoarthritis, what is the relationship between X-ray images showing a modified Kellgren-Lawrence scale score of 2 or higher and the presence of macroscopic cartilage defects in finger joints?",5,Diagnostics (Basel). 2025 Oct 22;15(21):2669. doi: 10.3390/diagnostics15212669.; Diagnostics (Basel). 2025 Oct 22;15(21):2669. doi: 10.3390/diagnostics15212669.; Diagnostics (Basel). 2025 Oct 22;15(21):2669. doi: 10.3390/diagnostics15212669.; Knee Surg Sports Traumatol Arthrosc. 2025 Nov 14. doi: 10.1002/ksa.70191.; Ann Med. 2025 Dec;57(1):2584361. doi: 10.1080/07853890.2025.2584361. Epub 2025
q_559774,In what scenarios might a nanoplatform leveraging noncovalent molecular interactions and photothermal mechanisms be considered for the treatment of immunologically cold tumors to enhance antigen presentation and overcome T-cell exclusion?,17,Acta Biomater. 2025 Nov 11:S1742-7061(25)00835-9. doi:; Acta Biomater. 2025 Nov 11:S1742-7061(25)00835-9. doi:; Acta Biomater. 2025 Nov 11:S1742-7061(25)00835-9. doi:; Acta Biomater. 2025 Nov 11:S1742-7061(25)00835-9. doi:; ACS Nano. 2025 Nov 14. doi: 10.1021/acsnano.5c14796.
q_156610,What is the role of DNA methylation profiles in predicting treatment outcomes of transcranial magnetic stimulation in patients with treatment-resistant depression?,7,BMC Med Genomics. 2025 Nov 12;18(1):181. doi: 10.1186/s12920-025-02240-2.; BMC Med Genomics. 2025 Nov 12;18(1):181. doi: 10.1186/s12920-025-02240-2.; BMC Med Genomics. 2025 Nov 12;18(1):181. doi: 10.1186/s12920-025-02240-2.; BMC Med Genomics. 2025 Nov 12;18(1):181. doi: 10.1186/s12920-025-02240-2.; Front Psychiatry. 2025 Oct 29;16:1671122. doi: 10.3389/fpsyt.2025.1671122.
q_277241,When should clinicians consider assessing standard modifiable cardiovascular risk factors in patients to prevent coronary artery disease?,9,Am J Prev Cardiol. 2025 Oct 15;24:101334. doi: 10.1016/j.ajpc.2025.101334.; BMC Cardiovasc Disord. 2025 Nov 12;25(1):807. doi: 10.1186/s12872-025-05301-7.; PLoS One. 2025 Nov 13;20(11):e0334881. doi: 10.1371/journal.pone.0334881.; Am J Prev Cardiol. 2025 Oct 15;24:101334. doi: 10.1016/j.ajpc.2025.101334.; JMIR Med Inform. 2025 Nov 13;13:e76659. doi: 10.2196/76659.
q_893057,"What is the role of adhesion profile in diagnosing CAD patients, and how does its sensitivity and specificity compare to other diagnostic methods based on the ROC curve analysis?",8,J Thromb Thrombolysis. 2025 Nov 8. doi: 10.1007/s11239-025-03204-0.; J Thromb Thrombolysis. 2025 Nov 8. doi: 10.1007/s11239-025-03204-0.; J Thromb Thrombolysis. 2025 Nov 8. doi: 10.1007/s11239-025-03204-0.; Open Med (Wars). 2025 Nov 4;20(1):20251320. doi: 10.1515/med-2025-1320.; Front Cardiovasc Med. 2025 Oct 29;12:1651935. doi: 10.3389/fcvm.2025.1651935.
q_139811,"What is the potential use of noncoding RNAs, including miRNAs, lncRNAs, circRNAs, and piRNAs, in the management of NAFLD and NASH, specifically as biomarkers for early diagnosis and as therapeutic targets?",9,Int J Mol Sci. 2025 Oct 26;26(21):10402. doi: 10.3390/ijms262110402.; Int J Mol Sci. 2025 Oct 26;26(21):10402. doi: 10.3390/ijms262110402.; Int J Mol Sci. 2025 Oct 26;26(21):10402. doi: 10.3390/ijms262110402.; Pharmacol Ther. 2025 Nov 12:108956. doi: 10.1016/j.pharmthera.2025.108956.; BMC Cancer. 2025 Nov 14;25(1):1768. doi: 10.1186/s12885-025-15237-y.
q_788863,"What is the proposed mechanism by which vagus nerve stimulation may exert therapeutic effects in patients with adenomyosis, based on the observed sympatho-vagal imbalance in these patients?",5,Reprod Fertil. 2025 Oct 14;6(4):e250039. doi: 10.1530/RAF-25-0039. Print 2025 Oct; Reprod Fertil. 2025 Oct 14;6(4):e250039. doi: 10.1530/RAF-25-0039. Print 2025 Oct; Reprod Fertil. 2025 Oct 14;6(4):e250039. doi: 10.1530/RAF-25-0039. Print 2025 Oct; Reprod Fertil. 2025 Oct 14;6(4):e250039. doi: 10.1530/RAF-25-0039. Print 2025 Oct; Neuromodulation. 2025 Oct 17:S1094-7159(25)01031-1. doi:
q_948003,"In patients with preeclampsia, when should clinicians consider measuring angiogenetic factors, such as those involved in the pathogenesis of the disease, to assess disease severity and guide management decisions?",13,Int J Mol Sci. 2025 Oct 27;26(21):10431. doi: 10.3390/ijms262110431.; Int J Mol Sci. 2025 Oct 27;26(21):10431. doi: 10.3390/ijms262110431.; Cureus. 2025 Oct 2;17(10):e93723. doi: 10.7759/cureus.93723. eCollection 2025; Am J Obstet Gynecol. 2025 Nov 11:S0002-9378(25)00828-2. doi:; Taiwan J Obstet Gynecol. 2025 Nov;64(6):996-1003. doi:
q_916695,"In what scenarios might psychosocial factors, in addition to mechanical or pathological causes, be considered when evaluating and managing lactation-related pain in breastfeeding women?",10,Brain Sci. 2025 Oct 8;15(10):1087. doi: 10.3390/brainsci15101087.; Brain Sci. 2025 Oct 8;15(10):1087. doi: 10.3390/brainsci15101087.; Brain Sci. 2025 Oct 8;15(10):1087. doi: 10.3390/brainsci15101087.; BMC Pregnancy Childbirth. 2025 Oct 17;25(1):1112. doi:; J Hum Lact. 2025 Oct 9:8903344251385524. doi: 10.1177/08903344251385524.
q_058223,What is the potential therapeutic effect of disrupting osteopontin (OPN) expression on cognitive impairments associated with neuroHIV in individuals with chronic viral infection?,9,Brain Behav Immun. 2025 Nov 10:106168. doi: 10.1016/j.bbi.2025.106168.; Brain Behav Immun. 2025 Nov 10:106168. doi: 10.1016/j.bbi.2025.106168.; Brain Behav Immun. 2025 Nov 10:106168. doi: 10.1016/j.bbi.2025.106168.; Brain Behav Immun. 2025 Nov 10:106168. doi: 10.1016/j.bbi.2025.106168.; J Extracell Vesicles. 2025 Nov;14(11):e70191. doi: 10.1002/jev2.70191.
q_436377,What compound was isolated from the palm fungus Leptosporella and reported in the Journal of Natural Products in 2025?,2,J Nat Prod. 2025 Nov 10. doi: 10.1021/acs.jnatprod.5c01018.; J Nat Prod. 2025 Nov 10. doi: 10.1021/acs.jnatprod.5c01018.
q_979344,What are the potential long-term consequences of neonatal acute kidney injury (AKI) in children and adults?,16,Pediatr Nephrol. 2025 Nov 14. doi: 10.1007/s00467-025-06978-w.; Front Nephrol. 2025 Oct 22;5:1671763. doi: 10.3389/fneph.2025.1671763.; JAMA Netw Open. 2025 Nov 3;8(11):e2543270. doi:; Pediatr Nephrol. 2025 Nov 14. doi: 10.1007/s00467-025-06978-w.; JAMA Netw Open. 2025 Nov 3;8(11):e2543270. doi:
q_634867,"What are the mechanisms by which vitamin D deficiency contributes to adverse metabolic outcomes, such as insulin resistance and diabetes mellitus, in individuals with Down syndrome?",8,Int J Mol Sci. 2025 Nov 5;26(21):10756. doi: 10.3390/ijms262110756.; Int J Mol Sci. 2025 Nov 5;26(21):10756. doi: 10.3390/ijms262110756.; Int J Mol Sci. 2025 Nov 5;26(21):10756. doi: 10.3390/ijms262110756.; Int J Mol Sci. 2025 Oct 22;26(21):10256. doi: 10.3390/ijms262110256.; Int J Mol Sci. 2025 Oct 22;26(21):10256. doi: 10.3390/ijms262110256.
q_984253,"What is the main difference between the therapeutic approaches aimed at reducing damage and those aimed at enabling regeneration in patients with lung conditions, according to the framework presented?",4,Cells. 2025 Nov 4;14(21):1731. doi: 10.3390/cells14211731.; BMC Pulm Med. 2025 Nov 10;25(1):516. doi: 10.1186/s12890-025-03965-7.; Life Sci. 2025 Dec 1;382:124040. doi: 10.1016/j.lfs.2025.124040. Epub 2025 Oct; J Inflamm Res. 2025 Oct 25;18:14737-14753. doi: 10.2147/JIR.S547454. eCollection
q_243234,"In patients undergoing total knee arthroplasty (TKA) with severe varus deformity (> 10 degrees), what is the most commonly released structure to achieve soft tissue balance?",5,J Orthop Surg Res. 2025 Oct 29;20(1):940. doi: 10.1186/s13018-025-06313-x.; J Orthop Surg Res. 2025 Oct 29;20(1):940. doi: 10.1186/s13018-025-06313-x.; J Orthop Surg Res. 2025 Oct 29;20(1):940. doi: 10.1186/s13018-025-06313-x.; Cureus. 2025 Oct 6;17(10):e93939. doi: 10.7759/cureus.93939. eCollection 2025; Zhongguo Gu Shang. 2025 Oct 25;38(10):1055-60. doi:
q_365792,What are some current and emerging therapies that can counteract inflammatory bone loss?,16,Nat Rev Rheumatol. 2025 Nov 13. doi: 10.1038/s41584-025-01323-9.; Nat Rev Rheumatol. 2025 Nov 13. doi: 10.1038/s41584-025-01323-9.; Molecules. 2025 Oct 22;30(21):4154. doi: 10.3390/molecules30214154.; Cells. 2025 Oct 22;14(21):1649. doi: 10.3390/cells14211649.; Phytomedicine. 2025 Oct 26;148:157472. doi: 10.1016/j.phymed.2025.157472.
q_906613,In what scenarios should clinicians consider implementing AI-based screening models that?,16,Cancers (Basel). 2025 Oct 30;17(21):3491. doi: 10.3390/cancers17213491.; Cancers (Basel). 2025 Oct 30;17(21):3491. doi: 10.3390/cancers17213491.; J Gen Intern Med. 2025 Oct 28. doi: 10.1007/s11606-025-09938-0.; BMC Palliat Care. 2025 Oct 28;24(1):274. doi: 10.1186/s12904-025-01909-w.; JAMIA Open. 2025 Oct 26;8(5):ooaf133. doi: 10.1093/jamiaopen/ooaf133. eCollection
